{
  "schema_version": 1,
  "benchmark_id": "pdf-tools.mutation-fidelity.v1",
  "benchmark_version": 1,
  "documents": [
    {
      "id": "pdf-tools.fidelity.document.comparison-base",
      "path": "../comparison/synthetic/comparison-base.pdf",
      "sha256": "83228dc849486ef78b8be0f663e9daa8a7641a9d0cc7c6af9a5f443ae5fcc4dc"
    },
    {
      "id": "pdf-tools.fidelity.document.page-order-source",
      "path": "../synthetic/dev-page-order-source.pdf",
      "sha256": "bca00ea1e9c27e45c58ace3a80d4df0a56db91c15c0e3d812fe3d22a925b2168"
    }
  ],
  "measurement_policy": {
    "repetitions": 3,
    "required_engine_families": ["pdfjs", "poppler"],
    "renderer": {
      "dpi": 144,
      "scale": 2,
      "pixel_delta_thresholds": [0, 2, 8],
      "unexpected_delta_threshold": 8,
      "intended_region_halo_pixels": 2,
      "connected_components": 8
    },
    "no_gate_averaging": true,
    "retain_failure_evidence": true
  },
  "cases": [
    {
      "id": "pdf-tools.fidelity.case.fill-new-output",
      "family": "fill",
      "inputs": [{ "logical_path": "input/source.pdf", "document_id": "pdf-tools.fidelity.document.comparison-base" }],
      "tool_calls": [{ "name": "fill_pdf", "arguments": { "pdf_path": "input/source.pdf", "output_path": "output/filled.pdf", "field_data": { "ReviewStatus": "Approved" } } }],
      "expected_outputs": ["output/filled.pdf"],
      "page_lineage": [
        { "output_path": "output/filled.pdf", "output_page": 1, "source_path": "input/source.pdf", "source_page": 1, "anchor": "PAGE-ID: SERVICE", "rotation_delta": 0 },
        { "output_path": "output/filled.pdf", "output_page": 2, "source_path": "input/source.pdf", "source_page": 2, "anchor": "PAGE-ID: APPENDIX", "rotation_delta": 0 }
      ],
      "intended_regions": [{ "output_path": "output/filled.pdf", "page": 1, "region": [71.5, 331.5, 221, 31], "reason": "ReviewStatus widget appearance", "required_visible_delta": true, "target_evidence": { "kind": "field_appearance", "field_name": "ReviewStatus", "expected_value": "Approved" } }],
      "semantics": [{
        "output_path": "output/filled.pdf",
        "fields": [{ "name": "ReviewStatus", "type": "PDFTextField", "flags": 0, "value": "Approved", "widgets": [{ "page": 1, "region": [71.5, 331.5, 221, 31], "appearance_state": null, "has_normal_appearance": true }] }],
        "annotations": [],
        "metadata": { "preserve_from": "input/source.pdf", "preserve_keys": ["Title", "Author", "Subject", "Keywords", "Creator", "CreationDate"], "allowed_change_keys": ["Producer", "ModDate"], "required_patterns": {} }
      }],
      "filesystem": { "created": ["output/filled.pdf"], "created_directories": [], "modified": [], "deleted": [], "dynamic_created_patterns": [] },
      "lifecycle": { "active_path": "output/filled.pdf", "last_mutation_tool": "fill_pdf", "backup_policy": "none" },
      "required_gates": ["tool_execution", "artifact", "pdfjs_engine", "poppler_engine", "lineage", "geometry", "semantics", "target_evidence", "intended_visual", "forbidden_visual", "filesystem", "lifecycle"]
    },
    {
      "id": "pdf-tools.fidelity.case.apply-text",
      "family": "text",
      "inputs": [{ "logical_path": "input/source.pdf", "document_id": "pdf-tools.fidelity.document.comparison-base" }],
      "tool_calls": [{ "name": "apply_text", "arguments": { "pdf_path": "input/source.pdf", "output_path": "output/stamped.pdf", "page": 2, "x": 330, "y": 120, "width": 160, "height": 28, "text": "Reviewed 2026-07-21" } }],
      "expected_outputs": ["output/stamped.pdf"],
      "page_lineage": [
        { "output_path": "output/stamped.pdf", "output_page": 1, "source_path": "input/source.pdf", "source_page": 1, "anchor": "PAGE-ID: SERVICE", "rotation_delta": 0 },
        { "output_path": "output/stamped.pdf", "output_page": 2, "source_path": "input/source.pdf", "source_page": 2, "anchor": "PAGE-ID: APPENDIX", "rotation_delta": 0 }
      ],
      "intended_regions": [{ "output_path": "output/stamped.pdf", "page": 2, "region": [330, 120, 160, 28], "reason": "requested text stamp", "required_visible_delta": true, "target_evidence": { "kind": "text_run", "expected_text": "Reviewed 2026-07-21" } }],
      "semantics": [{
        "output_path": "output/stamped.pdf",
        "fields": [{ "name": "ReviewStatus", "type": "PDFTextField", "flags": 0, "value": "", "widgets": [{ "page": 1, "region": [71.5, 331.5, 221, 31], "appearance_state": null, "has_normal_appearance": true }] }],
        "annotations": [],
        "metadata": { "preserve_from": "input/source.pdf", "preserve_keys": ["Title", "Author", "Subject", "Creator", "CreationDate"], "allowed_change_keys": ["Keywords", "Producer", "ModDate"], "required_patterns": { "Keywords": "stamped text via pdf-toolkit; text=\\\"Reviewed 2026-07-21\\\";.*page=2" } }
      }],
      "filesystem": { "created": ["output/stamped.pdf"], "created_directories": [], "modified": [], "deleted": [], "dynamic_created_patterns": [] },
      "lifecycle": { "active_path": "output/stamped.pdf", "last_mutation_tool": "apply_text", "backup_policy": "none" },
      "required_gates": ["tool_execution", "artifact", "pdfjs_engine", "poppler_engine", "lineage", "geometry", "semantics", "target_evidence", "intended_visual", "forbidden_visual", "filesystem", "lifecycle"]
    },
    {
      "id": "pdf-tools.fidelity.case.apply-text-rotated-crop",
      "family": "text",
      "inputs": [{ "logical_path": "input/source.pdf", "document_id": "pdf-tools.fidelity.document.page-order-source" }],
      "tool_calls": [{ "name": "apply_text", "arguments": { "pdf_path": "input/source.pdf", "output_path": "output/stamped.pdf", "page": 2, "x": 72, "y": 250, "width": 180, "height": 30, "text": "ROTATED CHECK" } }],
      "expected_outputs": ["output/stamped.pdf"],
      "page_lineage": [
        { "output_path": "output/stamped.pdf", "output_page": 1, "source_path": "input/source.pdf", "source_page": 1, "anchor": "PAGE ONE - PORTRAIT", "rotation_delta": 0 },
        { "output_path": "output/stamped.pdf", "output_page": 2, "source_path": "input/source.pdf", "source_page": 2, "anchor": "PAGE TWO - ROTATED", "rotation_delta": 0 }
      ],
      "intended_regions": [{ "output_path": "output/stamped.pdf", "page": 2, "region": [72, 250, 180, 30], "reason": "text stamp on cropped and intrinsically rotated page", "required_visible_delta": true, "target_evidence": { "kind": "text_run", "expected_text": "ROTATED CHECK" } }],
      "semantics": [{
        "output_path": "output/stamped.pdf",
        "fields": [],
        "annotations": [],
        "metadata": { "preserve_from": "input/source.pdf", "preserve_keys": ["Title", "Author", "Subject", "Creator", "CreationDate"], "allowed_change_keys": ["Keywords", "Producer", "ModDate"], "required_patterns": { "Keywords": "stamped text via pdf-toolkit; text=\\\"ROTATED CHECK\\\";.*page=2" } }
      }],
      "filesystem": { "created": ["output/stamped.pdf"], "created_directories": [], "modified": [], "deleted": [], "dynamic_created_patterns": [] },
      "lifecycle": { "active_path": "output/stamped.pdf", "last_mutation_tool": "apply_text", "backup_policy": "none" },
      "required_gates": ["tool_execution", "artifact", "pdfjs_engine", "poppler_engine", "lineage", "geometry", "semantics", "target_evidence", "intended_visual", "forbidden_visual", "filesystem", "lifecycle"]
    },
    {
      "id": "pdf-tools.fidelity.case.prepare-signing-packet",
      "family": "signing_preparation",
      "inputs": [{ "logical_path": "input/source.pdf", "document_id": "pdf-tools.fidelity.document.comparison-base" }],
      "tool_calls": [{ "name": "prepare_signing_packet", "arguments": { "pdf_path": "input/source.pdf", "output_path": "output/packet.pdf", "field_values": { "ReviewStatus": "Pending signature" }, "signature_locations": [{ "page": 2, "x": 330, "y": 650, "width": 180, "height": 36, "label": "Applicant signature" }] } }],
      "expected_outputs": ["output/packet.pdf"],
      "page_lineage": [
        { "output_path": "output/packet.pdf", "output_page": 1, "source_path": "input/source.pdf", "source_page": 1, "anchor": "PAGE-ID: SERVICE", "rotation_delta": 0 },
        { "output_path": "output/packet.pdf", "output_page": 2, "source_path": "input/source.pdf", "source_page": 2, "anchor": "PAGE-ID: APPENDIX", "rotation_delta": 0 }
      ],
      "intended_regions": [
        { "output_path": "output/packet.pdf", "page": 1, "region": [71.5, 331.5, 221, 31], "reason": "ReviewStatus widget appearance", "required_visible_delta": true, "target_evidence": { "kind": "field_appearance", "field_name": "ReviewStatus", "expected_value": "Pending signature" } },
        { "output_path": "output/packet.pdf", "page": 2, "region": [330, 650, 180, 36], "reason": "visible sign-here placeholder", "required_visible_delta": true, "target_evidence": { "kind": "text_run", "expected_text": "Applicant signature" } }
      ],
      "semantics": [{
        "output_path": "output/packet.pdf",
        "fields": [{ "name": "ReviewStatus", "type": "PDFTextField", "flags": 0, "value": "Pending signature", "widgets": [{ "page": 1, "region": [71.5, 331.5, 221, 31], "appearance_state": null, "has_normal_appearance": true }] }],
        "annotations": [],
        "metadata": { "preserve_from": "input/source.pdf", "preserve_keys": ["Title", "Author", "Subject", "Keywords", "Creator", "CreationDate"], "allowed_change_keys": ["Producer", "ModDate"], "required_patterns": {} }
      }],
      "filesystem": { "created": ["output/packet.pdf"], "created_directories": [], "modified": [], "deleted": [], "dynamic_created_patterns": [] },
      "lifecycle": { "active_path": "output/packet.pdf", "last_mutation_tool": "prepare_signing_packet", "backup_policy": "none" },
      "required_gates": ["tool_execution", "artifact", "pdfjs_engine", "poppler_engine", "lineage", "geometry", "semantics", "target_evidence", "intended_visual", "forbidden_visual", "filesystem", "lifecycle"]
    },
    {